id,stc,estc,title,author,publisher,pubplace,keywords,date
B02730,D1782E,R176897,"An extempore sermon, preached upon malt, by a way of caution to good fellows; at the request of two schollars, / by a lover of ale, out of a hallow [sic] tree.","Lover of ale.; Dod, John, 1549?-1645.",s n,No pubplace,Temperance --  Great Britain --  Early works to 1800. -- Alcoholism --  Great Britain --  Early works to 1800. -- Broadsides --  England --  17th century. -- Broadsides --  Scotland --  17th century.,1691
B04893,P4317,None,"Pyramus and Thisbe: or, Love's master-piece. Behold the downfall of two lovers dear, and to their memorys, let fall a tear, a sad mistake their ruine did procure, when as they thought their friendship should endure; oh cruel fate! That cut them off in prime, and for enjoyment, would afford no time. To the tune of, Digby's farewel.",Anonymous,Printed for W illiam Thackeray T homas Passenger and W illiam Whitwood,London,"Ballads, English --  17th century.",1670-1677?
B03989,L1227A,R179469,"The committee, or, Popery in masquerade","L'Estrange, Roger, Sir, 1616-1704.",s n,London,"Dissenters, Religious --  England --  Early works to 1800. -- Broadsides --  England --  London --  17th century",1680
B06137,T1598,R185342,"To the Queen, on her birth-day",Anonymous,s n,London,"Catherine, --  of Braganza, Queen, consort of Charles II, King of England, 1638-1705 --  Poetry. -- Broadsides --  England --  17th century.",1663
B01914,C1110,R171011,The case of the makers of vinegar,Anonymous,s n,London,Vinegar industry --  Law and legislation --  England --  Early works to 1800. -- Vinegar --  Taxation --  Law and legislation --  England --  Early works to 1800. -- Broadsides --  England --  17th century.,1690
B06605,W2339,R186644,"His Majesties gracious message to the Convocation, sent by the Earl of Nottingham.","William III, King of England, 1650-1702.; Church of England. Province of Canterbury. Convocation.; England and Wales. Sovereign (1689-1694 : William and Mary)",s n,No pubplace,Church of England. --  Province of Canterbury. --  Convocation --  Early works to 1800. -- Church and state --  England --  17th century --  Early works to 1800. -- Broadsides --  Scotland --  17th century.,1689
B03219,E398,R36108,"An elegy on the death of the most illustrious Lord, the Earl of St. Albans: who departed this life the first day of this instant January, 1684.",Anonymous,Printed for I Deacon at the Angel in Guilt spur street without New Gate,London,"St. Albans, Henry Jermyn, --  Earl of, ca. 1604-1684 --  Death and burial --  Poetry --  Early works to 1800. -- Elegiac poetry, English --  17th century.",1684
B02599,C959B,R176223,"The case of Mr. Wynne, against Capell, Swaine and Price, petitioners.","Wynne, Mr.; Capell, John.; Swaine, Robert.; Price, John.",s n,London,Libel and slander --  England --  Early works to 1800. -- Broadsides --  England --  17th century.,1690
B03319,E950A,R228535,"By the Lords justices, a proclamation for apprehending and securing the person of John Robart. Tho. Cantuar J. Sommers C.S. Pembroke C.P.S. Shrewsbury, Dorset, Godolphin.",Great Britain. Lords Justices.,s n,London,"Robart, John. -- Warrants (Law) --  Great Britain --  Early works to 1800. -- Broadsides --  England --  London --  17th century",1695
B01662,B2974,None,"A pleasant new song between a seaman, and his love. Shewing, though at the first in misery his time he spent he met his love at last, with joy and sweet content. The tune is Robin the devil.","Birket, Cuthbert.",s n,London,"Ballads, English --  17th century.",1670
B05749,S2013EA,R183612,"A proclamation, for rouping the in-land excise of this kingdom",Scotland. Privy Council.,Printed by the heir of Andrew Anderson,Edinburgh,Excise tax --  Law and legislation --  Scotland --  Early works to 1800. -- Broadsides --  Scotland --  17th century.,1691
B01384,A3249,R30700,"Another ballad: called The libertines lampoone: or, The curvets of conscience. To the tune of, Thomas Venner, or 60. / Written by the authour of the Geneva Ballad.","Butler, Samuel, 1612-1680.",Printed for F K and Edward Thomas and are to be sold at his shop at the Adam and Eve in Little Brittain,London,"Political ballads and songs --  England --  Early works to 1800. -- Conscience --  Early works to 1800. -- Ballads, English --  17th century.",1674
B04798,P3229A,R182024,The presbytery. A satyr,Anonymous,s n,S l,"Religious satire, English --  Poetry --  Early works to 1800. -- Broadsides --  England --  17th century.",1649
B05649,S1856,R183508,A proclamation for choosing the additional representatives of barons to the Parliament,Scotland. Privy Council.; Scotland. Sovereign (1689-1694 : William and Mary),Printed by the heir of Andrew Anderson Printer to their most excellent Majesties,Edinburgh,Scotland. --  Parliament --  Elections --  Early works to 1800. -- Scotland --  Politics and government --  1689-1702 --  Sources. -- Broadsides --  Scotland --  17th century.,1690
B01762,B4093,R208011,"An humble petition unto the high and most honourable Courts of Parliament, that they would be pleased to condiseend [sic] to the perusing of these short notes, tending to the refining of the Booke of Common-Prayer, in a few things. / By Theophilus Brabourn.","Brabourne, Theophilus, b. 1590.",s n,London,Church of England. --  Book of common prayer. --  Psalter. -- Broadsides --  England --  London --  17th century,1661
B00504,19251.7,None,"A lovers teares: or, The constancy of a yong mans mind, although his choyce be too unkind. All you yong men who heare this ditty, a lovers teares bemoane with pitty. To the tune of Sigh, sob, and weepe.","M. P. (Martin Parker), d. 1656?; M. P. (Martin Parker), d. 1656?",for Tho Lambert at the sign of the Hors shoo in Smithfield,Printed at London,"Ballads, English --  17th century.",1634
B06129,T1559A,R185324,"To the Kings most sacred Majesty : the most faithful and unfeigned thanks and resolves of the mayor, sheriffs, aldermen, citizens and commonality of the city of Norwich, in Common Council assembled ...",Norwich (England). Common Council.; Norwich (England). Common Council.,s n,S l,"Charles --  II, --  King of England, 1630-1685. -- Great Britain --  Kings and rulers --  Succession --  Early works to 1800. -- Norwich (England) --  History --  17th century --  Early works to 1800. -- Great Britain --  Politics and government --  1660-1688 --  Early works to 1800. -- Broadsides --  Scotland --  17th century.",1681
B03264,E458,R36257,"An elegie upon Mr. Thomas Hobbes of Malmesbury, lately deceased.",Anonymous,s n,London,"Hobbes, Thomas, 1588-1679 --  Poetry --  Early works to 1800. -- Hobbes, Thomas, 1588-1679 --  Early works to 1800.",1679
B02102,C3208,R236092,"By the King. A proclamation. Charles R. ... We having, with the advice and consent of Our Parliaments, past so many acts in favors of the Protestant religion, against field-conventicles ...","Scotland. Sovereign (1649-1685 : Charles II); Scotland. Sovereign (1649-1685 : Charles II); Charles II, King of England, 1630-1685.",Printed by the heir of Andrew Anderson printer to his most sacred Majesty,Edinburgh,"Dissenters, Religious --  Legal status, laws, etc. --  Scotland --  Early works to 1800. -- Church and state --  Scotland --  Early works to 1800. -- Broadsides --  Scotland --  17th century.",1679
B06778,Y115,None,"The young-mans conquest over the powers of darkness. In a dialogue, between a virtuous young-man, and the subtile insinuating tempter; discovering the baits of Satan, and the strength of temptation: with the Christians fortitude, and only means of overcoming, which is by faith in Christ, and unwearied perseverance. Eph. 6. chap. 11. Put on the whole armour of God, that you may withstand the wiles of the devil. Necessary to be set up in all houses.",Anonymous,Printed for J Coniers at the Black Raven in Duck Lane,London,Temptation --  Poetry --  Early works to 1800.,1684
B00479,19071,None,A meruaylous straunge deformed swyne.,"I. P.; Philips, John, fl. 1570-1591.; Partridge, John, fl. 1566-1573.; Pitts, John, fl. 1559-1577.",by VVilliam Hovv for Richard Iohnes and are to be solde at his shop ioyning to the southwest doore of Paules Churche,Imprinted at London,Animals --  Abnormalities --  Early works to 1800.,1570
B04552,N576,None,"A new ballad, to the tune of, Good people give ear, while a story I tell, of twenty black tradesmen were brought up in Hell, &c. or, Packington's Pound.",Anonymous,s n,London,"Ballads, English --  17th century.",1680-1685?
B05583,S1767,R225731,"A proclamation, discharging the importing of forraign linen, or woolen cloth, gold and silver threed, &c.",Scotland. Privy Council.; Scotland. Sovereign (1649-1685 : Charles II),Printed by the heir of Andrew Anderson Printer to his most sacred Majesty,Edinburgh,Textile industry --  Law and legislation --  Scotland --  Early works to 1800. -- Non-tariff trade barriers --  Law and legislation --  Scotland --  Early works to 1800. -- Broadsides --  Scotland --  17th century.,1681
B05634,S1830,R183496,"Proclamation, for apprehending Fergus Tempeltoun a murderer.",Scotland. Privy Council.; Scotland. Sovereign (1689-1694 : William and Mary),Printed by the successors of Andrew Anderson Printers to their most excellent Majesties,Edinburgh,"Templetoun, Fergus, fl. 1694. -- Murderers --  Scotland --  Early works to 1800. -- Arrest --  Scotland --  Early works to 1800. -- Broadsides --  Scotland --  17th century.",1694
B05645,S1845,R183504,"Proclamation for bringing in the lists, and determining debates about the pole-money.",Scotland. Privy Council.; Scotland. Sovereign (1689-1694 : William and Mary),Printed by the heirs and successors of Andrew Anderson Printer to their most excellent Majesty,Edinburgh,Poll tax --  Law and legislation --  Scotland --  Early works to 1800. -- Tax collection --  Scotland --  Early works to 1800. -- Broadsides --  Scotland --  17th century.,1694
B02837,D2794,None,"A vvord in season: or, Now or never. Tis ne'r too late to be advised well regard it then you beauties that excel both in external and internal parts and do not triumph over captive hearts: least you ingrateful being left to time bereft of charmes, be punisht that black crime. A pleasant new tune, of Sweet use your time, &c.","D'Urfey, Thomas, 1653-1723.",Printed for J Wright J Clark W Thackery and T Pass i nger,London,"Ballads, English --  17th century.",1681-1684?
B05745,S2013,R183607,"Apud Edinburgum undecimo Maii 1643. Forasmeikle as the Lords of Privie Councell, commissioners for conserving the peace, and commissioners for the common burdens, taking to their consideration the necessitites of the Scottish Army ...",Scotland. Privy Council.,by Evan Tyler Printer to the Kings most excellent Majestie,Printed at Edinburgh,Scotland. --  Army --  Finance --  Law and legislation --  Early works to 1800. -- Scotland --  Politics and government --  1642-1649 --  Sources. -- Broadsides --  Scotland --  17th century.,1643
B01388,A3354A,R176291,An answer to Clemens Alexandrinus's sermon upon Quis dives salvetur? What rich man can be sav'd? Proving it easie for a camel to go through the eye of a needle.,"Clement, of Alexandria, Saint, ca. 150-ca. 215. Quis dives salvetur?",s n,London,"Clement, --  of Alexandria, Saint, ca. 150-ca. 215. --  Quis dives salvetur? -- Wealth --  Moral and ethical aspects --  Early works to 1800. -- Rich people --  Humor --  Early works to 1800. -- Broadsides --  England --  17th century.",1690
B06609,W2367B,R186654,His Majesties letter to the Parliament,"England and Wales. Sovereign (1694-1702 : William III); England and Wales. Sovereign (1694-1702 : William III); William III, King of England, 1650-1702.; Scotland. Parliament.",Printed by the heirs and successors of Andrew Anderson printer to his most Excellent Majesty,Edinburgh,"Mary --  II, --  Queen of England, 1662-1694 --  Death and burial --  Early works to 1800. -- Great Britain --  History --  William and Mary, 1689-1702 --  Early works to 1800. -- Broadsides --  Scotland --  17th century.",1695
B02722,D1728,None,A divine poem of Christs fulness and a Christians happiness.,Anonymous,Printed for John Andrews at the white Lion near Pye Corner,London,Jesus Christ --  Poetry --  Early works to 1800. -- Jesus Christ --  Divinity --  Early works to 1800.,1660
B02595,C950,R223216,"The case of Mary Walwyn, widow of John Walwyn Esq; against the right honourable Charles Earl of Monmouth.","Walwyn, Mary.",s n,London,"Walwyn, Mary --  Trials, litigation, etc. --  Early works to 1800. -- Peterborough, Charles Mordaunt, --  Earl of, 1658-1735 --  Trials, litigation, etc. --  Early works to 1800. -- Decedents' family maintenance --  England --  Early works to 1800. -- Broadsides --  England --  17th century.",1691
B05638,S1838,R183499,Proclamation for apprehending Sir George Barclay,Scotland. Privy Council.; Scotland. Sovereign (1694-1702 : William II),Printed by the heirs and successors of Andrew Anderson,Edinburgh,"Barclay, George, --  Sir, fl. 1696. -- Conspiracies --  Great Britain --  17th century --  Sources. -- Great Britain --  History --  William and Mary, 1689-1702 --  Early works to 1800. -- Scotland --  Politics and government --  1689-1745 --  Early works to 1800. -- Broadsides --  Scotland --  17th century.",1696
B05738,S1991,R183594,"A proclamation, taking off the imbargo put upon ships",Scotland. Privy Council.; Scotland. Sovereign (1685-1688 : James VII),Printed by the heir of Andrew Anderson Printer to his most sacred Majesty,Edinburgh,"Embargo --  Scotland --  Early works to 1800. -- Monmouth's Rebellion, 1685 --  Early works to 1800. -- Broadsides --  Scotland --  17th century.",1685
B01906,C1088,R205801,"The case of the honourable Fytton Gerard Esq; returned to serve in Parliament for the borough of Clitheroe, against John Weddall Esq; appointed to be heard on the 15th day of this instant January.","Macclesfield, Fitton Gerard, Earl of,  1664 or 5-1702.",s n,London,"Macclesfield, Fitton Gerard, --  Earl of, 1664 or 5-1702 --  Trials, litigation, etc. -- Weddell, John, 1652 or 3-1703 --  Trials, litigation, etc. -- England and Wales. --  Parliament. --  House of Commons --  Contested elections --  Early works to 1800. -- Elections --  Corrupt practices --  England --  Clitheroe --  Early works to 1800. -- Clitheroe (England) --  Politics and government --  17th century --  Early works to 1800. -- Broadsides --  England --  17th century.",1694
B03368,F2031,None,"The fox too cunning for the lyon. Or, The foxes feast, wherein is exprest many a witty but most true jest, both old and young of it take a view, and by experience you'l say it's true. To the tune of, The Three cheators.",Anonymous,Printed for Charles Tytus on London Bridge,London,"Ballads, English --  17th century.",1659-1663?
B06774,Y112,R186956,"The youngmans careless wooing; and the witty maids replication; all done out of old English proverbs. : to the tune of, Mars and Venus. / This may be printed. R.P.",R. P.,Printed for P Brooksby at the Golden Ball in Pye Corner,London,"Ballads, English --  17th century. -- Broadsides --  England --  17th century.",1680
B06292,T3171A,R185762,"Truth's integrity, or, A curious northern ditty called, Love will find out the way. To a pleasant new tune.",Anonymous,Printed for F Coles J W T Vere and W Gilbertson,London,"Ballads, English --  17th century. -- Broadsides --  England --  17th century.",1655-1658?
B06674,W3244B,R186789,"The Wofull lamentation of Mistris Jane Shore, a goldsmiths wife in London, sometimes King Edward the Second's concubine, who for her wanton life came to a miserable end. Set forth for the example of all lewd women. The tune is, Live with me.",Anonymous,Printed for F Coles T Vere and W Gilbertson,London,"Shore, Jane d. 1527? --  Poetry. -- Ballads, English --  17th century. -- Broadsides --  England --  17th century.",1658-1664?
B06717,W43,None,"A pleasant jigg betwixt Jack and his mistress: or, The young carman's courage cool'd by the suddain [sic] approach, of his master, who found him too kind to his mistress. Tune of Mary live long. Licensed according to order.",Anonymous,Printed for J Deacon,London,Broadsides --  England --  London --  Early works to 1800. -- Jealousy --  Early works to 1800. -- Mistresses --  Early works to 1800. -- Triangles (Interpersonal relations) --  Early works to 1800. -- Ballads --  England --  17th century.,1684-1695?
B06146,T1651C,R185242,"To the right honourable Lord High Chancellor, and remanent lords of his Majesties most honourable Privy Council. The humble petition of his Majesties printer and servants.",Anonymous,unknown,unknown,Printers --  Scotland --  Early works to 1800. -- Broadsides --  Scotland --  17th century.,1685
B02929,D983A,R175931,"Elegie on the universally lamented death, of Duncan Ronald: Director depute of the Chancelary, and writer to His Majesties signet. Who died at Edinburgh, August 1700.","Dempster, George.",s n,Edinburgh,"Ronald, Duncan, d. 1700 --  Death and burial --  Poetry --  Early works to 1800. -- Elegiac poetry, English --  Scotland --  Early works to 1800. -- Broadsides --  Scotland --  17th century.",1700
B06802,Z1,R15733,An ansvver to the author of Humble thanks for His Majesties gracious declaration for liberty of conscience.,Y. Z.,Printed for J Edwin at the three Roses in Ludgate street,London,"Wild, Robert, 1609-1679. --  Dr Wild's humble thanks for His Majesties gracious declaration for liberty of conscience --  Early works to 1800. -- England and Wales. --  Sovereign (1660-1685 : Charles II) --  Poetry --  Early works to 1800. -- Dissenters, Religious --  England --  Poetry --  Early works to 1800.",1672
B03427,F392,None,The phanatick anatomized.,Anonymous,s n,London,"Dissenters, Religious --  Poetry --  Early works to 1800.",1672
B02110,C3310A,R175752,"By the King. A proclamation, for a publick general fast, throughout the realm of Scotland.","Scotland. Sovereign (1660-1685 : Charles II); Scotland. Sovereign (1660-1685 : Charles II); Charles II, King of England, 1630-1685.",Printed by Evan Tyler printer to the King s most Excellent Majesty,Edinbvrgh,"Fasts and feasts --  Church of Scotland --  Early works to 1800. -- Church and state --  Scotland --  Early works to 1800. -- Anglo-Dutch War, 1664-1667 --  Early works to 1800. -- Broadsides --  Scotland --  17th century.",1665
B03376,F2184,None,"The French dancing-master, and the English soldier: or, The difference betwixt fidling and fighting, displayed in a dialogue betwixt an English-man, and a French-man.",Anonymous,s n,London,Dance --  Poetry --  Early works to 1800. -- War --  Poetry --  Early works to 1800.,1666
B01918,C1118,R171015,"The case of the officers, ministers and attendants of his Majesty's late descent train of artillery, commanded by Sir Martin Beckman.",Anonymous,s n,London,"England and Wales. --  Army --  Pay, allowances, etc. --  Law and legislation --  Early works to 1800. -- Guards troops --  England --  Salaries, etc. --  Early works to 1800. -- Broadsides --  England --  17th century.",1693
B03276,E481,R36182,"An Egley [sic] upon the most execrable murther of Mr. Clun on [sic] of the comedeans of the Theator [sic] Royal, who was rob'd and most inhumanely kill'd on Tuseday-night [sic], being the 2d, of August, 1664. near Tatnam-Court, as he was riding to his country-house at Kentishtown.",Anonymous,Printed by Edward Crowch,London,"Clun, Walter, d. 1664 --  Poetry --  Early works to 1800. -- Elegiac poetry, English --  17th century.",1664
B05626,S1820,R226062,"A proclamation for adjourning the Parliament, to the twentieth of March next, 1696.",Scotland. Privy Council.; Scotland. Sovereign (1694-1702 : William II),Printed by the heirs and successors of Andrew Anderson Printer to the Kings most excellent Majesty,Edinburgh,Scotland. --  Parliament --  Early works to 1800. -- Scotland --  Politics and government --  1689-1745 --  Early works to 1800. -- Broadsides --  Scotland --  17th century.,1695
B03985,L1062,R179447,"Lent-preachers appointed to preach at White-hall, for the year 1687/8",Anonymous,Printed for Sam Carr,London,Church of England --  History --  17th century --  Sources. -- Church of England --  Clergy --  17th century --  Sources. -- Broadsides --  England --  17th century.,1688
B05591,S1775,R183457,A proclamation discharging the receipt of the rebels lately in armes in the VVest,Scotland. Privy Council.; Scotland. Sovereign (1649-1685 : Charles II),Printed by Evan Tyler Printer to the King s most excellent Majesty,Edinburgh,Treason --  Scotland --  Early works to 1800. -- Broadsides --  Scotland --  17th century.,1666
B05726,S1973,R183582,"Proclamation, recalling former acts or proclamations, declaring forraign victual free of duty, and ordaining all victuall to be imported to pay duty as before the saids former acts and proclamation.",Scotland. Privy Council.; Scotland. Sovereign (1694-1702 : William II),Printed by the heirs and successors of Andrew Anderson Printer to the King s most excellent Majesty,Edinburgh,Food law and legislation --  Scotland --  Early works to 1800. -- Foreign trade regulation --  Scotland --  Early works to 1800. -- Taxation --  Law and legislation --  Scotland --  Early works to 1800. -- Broadsides --  Scotland --  17th century.,1697
B01795,B4842,None,The tradesmans lamentation: or the mechanicks complaint.,"Brokeman, J.",Printed for the author,London,Great Britain --  Economic conditions --  17th century --  Poetry --  Early works to 1800.,1663
B00115,12548,None,"The witty vvesterne lasse: or, You maids, that with your friends whole nights have spent, beware back-fallings, for feare of the event. To a new tune, called The begger boy.","Guy, Robert, writer of ballads.",For I W,Printed at London,"Ballads, English --  17th century.",1635
B03608,H109A,None,"The maidens nay, or, I love not you. To a pleasant new tune.",R. H.,Printed for F Coles T Vere and J Wright,London,"Ballads, English --  17th century.",1663-1674?
B03159,E363,R36175,"An elegy on that great example of heroick valour the right honourable, Edvvard Earl of Sandvvich.",Anonymous,Printed for Philip Brooksby,London,"Sandwich, Edward Montagu, --  Earl of, 1625-1672 --  Poetry --  Early works to 1800. -- Elegiac poetry, English --  17th century.",1672
B06445,V464B,None,A vindication of a marriage life: in answer to the Broadside against marriage.,Anonymous,Printed for J L T Ashfield,London,"Broad-side against marriage directed to that inconsiderable annimal, called, a husband. -- Marriage --  Poetry --  Early works to 1800.",1675
B01880,B683,None,"Barbara Allen's cruelty: or, The young-man's tragedy. With Barbara Allen's [l]amentation for her unkindness to her lover, and her self. To the tune of Brbara [sic] Allen. Licensed according to order.",Anonymous,Printed for P Brooksby J Deacon J Blare J Back,London,"Ballads, English --  17th century.",1688-1692?
B05474,S1610B,R183345,A proclamation against the importation of victuall,"Scotland. Privy Council.; Gibson, Alexander, Sir, d. 1693.; Scotland. Sovereign (1649-1685 : Charles II)",Printed by Andrew Anderson Printer to his most sacred Majesty,Edinburgh,Foreign trade regulation --  Scotland --  Early works to 1800. -- Food law and legislation --  Scotland --  Early works to 1800. -- Broadsides --  Scotland --  17th century.,1676
B04143,L2885B,R179983,"By the Mayor. Whereas by an ancient law and statute of this realm, it is provided, that no fairs or markets be kept in church-yards ...","City of London (England). Lord Mayor.; City of London (England). Lord Mayor.; Frederick, John, Sir, fl. 1661-1662.",Printed by James Flesher Printer to the honourable city of London,London,Markets --  Law and legislation --  England --  London --  Early works to 1800. -- Broadsides --  England --  17th century.,1661
B05574,S1758,R183445,"Proclamation discharging the export, and allowing the import of victual.",Scotland. Privy Council.; Scotland. Sovereign (1694-1702 : William II),Printed by the heirs and successors of Andrew Anderson Printer to the King s most excellent Majesty,Edinburgh,Food law and legislation --  Scotland --  Early works to 1800. -- Foreign trade relations --  Scotland --  Early works to 1800. -- Broadsides --  Scotland --  17th century.,1699
B05092,R35A,R182331,"The valiant hearted sea-man; declaring a late skirmish fought between our English fleet and the Dutch. Wherein the Dutch was worsted, two of the Dutch ships sunk, and two taken as lawful prize, with a very small loss on the English side. The tune is, Lusty Stukely.",J. R. fl. 1665.,Printed for S Tyus,London,"Ballads, English --  17th century. -- Anglo-Dutch War, 1664-1667 --  Poetry. -- Naval battles --  Great Britain --  17th century --  Poetry. -- Broadsides --  England --  17th century.",1665
B02342,C5838,None,"A congratulatory poem, to the high and mighty Czar of Muscovy, on his arrival in England on Tuesday the 11th. of this instant January, 1697/8.",Anonymous,Printed and sold by J Bradford in Little Britain,London,No Keywords,1698
B03124,E3174D,R176746,"Epithalamium on the auspicious match, betwixt the right honourable the Earl of Wigtoun and the truly vertous lasy Margaret Lindsay daughter to the right honourable the Ear of Balcarros.",A. B.,s n,Edinburgh,"Ballads, Scots --  17th century. -- Epithalamia --  Scotland --  Early works to 1800. -- Broadsides --  Scotland --  17th century.",1698
B02413,C6538,None,"The country lass for me, give me the bonny country lass, take you the girls o'th city, the country girls do them surpass, though London girls are witty: the country girls in honesty, do citizens surpass, then once again I do proclaim, none like the country lass. The tune is, Hey boys up go we.",Anonymous,Printed for P hilip Brooksby in West smithfield,London,"Ballads, English --  17th century.",1680-1685?
