id,stc,estc,title,author,publisher,pubplace,keywords,date
B04484,N1006,None,"News from the coffe-house; in which is shewn their several sorts of passions, containing newes from all our neighbour nations. A poem.",Anonymous,Printed by E Crowch for Thomas Vere at the Cock in St John s street,London,Coffeehouses --  Poetry --  Early works to 1800.,1667
B04733,P2558,None,"A pleasant new song called The cony barber, or, A young ladies delight, how she trim'd her maid, when she was on the straw asleep. To a pleasant new West-country tune.",Anonymous,Printed for P Brooksby,London,"Ballads, English --  17th century.",1680-1685?
B04584,N765C,R180969,"A new song of Mallinger, or, The female-dear-joy tricked of her maiden-head. To a new Irish tune.",Anonymous,s n,S l,"Ballads, English --  17th century. -- Broadsides --  England --  17th century.",1700
B02808,D2621A,R33394,"A congratulatory poem to the ministers sons, on their splendid feast, Thursday December 7th, 1682.","Dunton, John, 1659-1733.",Printed by J A for John Dunton at the Black Raven in the Poultrey,London,Great Britain --  Politics and government --  1660-1688 --  Poetry --  Early works to 1800.,1682
B02908,D81,R171676,"On the death of Sir David Falconer of Newton, Lord President of the Council and Session.",R. D.,s n,Edinburgh,"Falconer, David, --  Sir, 1640-1686 --  Death and burial --  Poetry --  Early works to 1800. -- Elegiac poetry, English --  Scotland --  Early works to 1800. -- Broadsides --  Scotland --  17th century.",1686
B00437,18008,None,"Mondayes vvorke. Or The two honest neigbours both birds of a feather who are at the ale-house both merry together. To the tune of, I owe my hostesse money.",Anonymous,Printed for F Grove,London,"Ballads, English --  17th century.",1632
B01844,B5750D,R176248,Leader-haughs and Yarow. To its own proper tune.,"Burne, Nicol.",s n,Edinburgh,"Ballads, Scots --  17th century. -- Broadsides --  Scotland --  17th century.",1700
B06167,T1871,R185380,"Toms-son his repetition to his wife; bewailing his present state. To the tune of, Young Jemmy",Anonymous,Printed for J Deacon at the sign of the Rainbow between St Andrews Church and David s Inn in Holborn,London,"Monmouth, James Scott, --  Duke of, 1649-1685. -- Ballads, English --  17th century. -- Broadsides --  England --  17th century.",1679-1680?
B04187,L3104,R180074,A copy of a letter from the French king to King James in answer to one from him. Translated from the French copy.,"Louis XIV, King of France, 1638-1715.; James II, King of England 1633-1701.",s n,London printed,"Grand Alliance, War of the, 1689-1697 --  Sources. -- France --  Foreign relations --  England --  Early works to 1800. -- England --  Foreign relations --  France --  Early works to 1800. -- Broadsides --  England --  17th century.",1692
B05607,S1793,R183473,A proclamation for a solemn national fast and humiliation.,Scotland. Privy Council.; Scotland. Sovereign (1694-1702 : William II),Printed by the heirs and successors of Andrew Anderson Printer to his most excellent Majesty,Edinburgh,Prayers --  Law and legislation --  Scotland --  Early works to 1800. -- Fasts and feasts --  Church of Scotland --  Early works to 1800. -- Church and state --  Scotland --  Early works to 1800. -- Broadsides --  Scotland --  17th century.,1696
B04087,L2487,R179850,"A list of the prebendaries of the cathedral church of St. Paul's, London. Appointed by the Lords Commissioners to preach upon the holy-days in the year of our Lord, 1687. At Saint Peter's Church in Cornhill.",Church of England. Diocese of London.,Printed for W Kettilby,London,Church of England --  Clergy --  17th century --  Sources. -- Broadsides --  England --  17th century.,1687
B05707,S1941,R183565,"Proclamation indemnifying deserters, who shall return betwixt and the first day of January next to come.",Scotland. Privy Council.; Scotland. Sovereign (1694-1702 : William II),Printed by the heirs and successors of Andrew Anderson Printer to his most excellent Majesty,Edinburgh,"Military deserters --  Legal status, laws, etc. --  Scotland --  Early works to 1800. -- Broadsides --  Scotland --  17th century.",1696
B01939,C128A,None,"A brief remembrancer, or, The right improvement of Christ's birth-day.",T. C.,Printed by E T and R H for William Miller at the Gilded Acorn in S Pauls Church Yard near the Little North door,London,Jesus Christ --  Poetry --  Early works to 1800. -- Christmas --  Poetry --  Early works to 1800.,1672
B02131,C3623,R171288,"His Majesties two gracious letters, viz. one sent to the House of Peers, by Sir John Grenville Knight, from Breda. The other, to the Lord Mayor, Aldermen, and Common Council of the city of London.","Charles II, King of England, 1630-1685.; Sadler, Anthony, b. 1610.; City of London (England). Court of Common Council.",Re printed by Christopher Higgins in Harts Close over against the Trone Church,Edinburgh,"Great Britain --  Politics and government --  1660-1688 --  Early works to 1800. -- Great Britain --  History --  Restoration, 1660-1688 --  Early works to 1800. -- Broadsides --  Scotland --  17th century.",1660
B03257,E449,None,"An elegie to the indeared memory of that learned and reverend minister of the gospel Dr Lazarus Seaman, who died on Friday the 3d. of September 1675, and was carried from Drapers Hall to be interred, with a numerous train of Christian Friends bewailing his death.",Anonymous,Printed for D M,London,"Seaman, Lazarus, d. 1675 --  Poetry --  Early works to 1800. -- Elegiac poetry, English --  17th century.",1675
B06079,T107,None,"The taylor's wanton wife of Wapping: or, A hue-and-cry after a lac'd petticoat, flowr'd gown, and rich cornet; with other apparel, which was lost in the chamber of love. To the tune of What shall I do to show her how much I love her. Licensed according to order.",Anonymous,Printed for P Brooksby J Deacon J Blare and J Back,London,"Ballads, English --  17th century.",1690
B02603,C973,R170971,"The case of Robert Balch of Bridgwater gent., sitting member of Parliament for the borough of Bridgwater, in the county of Sommerset, petitioned against by John Gardner of London merchant.","Balch, Robert.",s n,London,"Balch, Robert --  Trials, litigation, etc. -- Gardner, John, 17th cent. --  Trials, litigation, etc. -- England and Wales. --  Parliament. --  House of Commons --  Contested elections --  Early works to 1800. -- Elections --  Corrupt practices --  England --  Bridgwater --  Early works to 1800. -- Bridgwater (England) --  Politics and government --  17th century --  Early works to 1800. -- Broadsides --  England --  17th century.",1692
B02703,D1567,None,"The discontented plow-man. This man was troubled in his mind, because his love did prove to him unkind; but now, she has granted his desire, and quench'd his lovesick heart which was on fire [sic] To the tune of, True love rewarded, or, Flora farewel.",Anonymous,Printed for F rancis Coles T homas Vere I ohn Wright and I ohn Clarke,London,"Ballads, English --  17th century.",1674-1679?
B02052,C2985,R171212,"King Charles II. his declaration to all his loving subjects of the kingdom of England. Dated from his Court at Breda in Holland, the 4/14 of April 1660. And read in Parliament, May, 1. 1660. Together with his Majesties letter of the same date, to his Excellence the Lord General Monck, to be communicated to the Lord President of the Council of State, and to the officers of the army under his command.","Charles II, King of England, 1630-1685.; Albemarle, George Monck, Duke of, 1608-1670.",Re printed by Christopher Higgins in Harts Close over against the Trone Church,Edinburgh,"Great Britain --  Politics and government --  1660-1688 --  Early works to 1800. -- Great Britain --  History --  Restoration, 1660-1688 --  Early works to 1800. -- Broadsides --  Scotland --  17th century.",1660
B05971,S5509,None,"The Quakers wedding, October, 24. 1671.","Stevenson, Matthew, fl. 1654-1685.",Printed for Rowland Reynolds at the Sun and Bible in the Poultry,London,Quakers --  Controversial literature --  Early works to 1800. -- Marriage --  Poetry --  Early works to 1800.,1671
B06179,T2048,None,"The trappand cuckold-maker. Or, Yea-and-nay well fitted. A baker went with full intent, a beauty to adore; thus yea and nay, did run astray, but he'll do so no more. Tune is, O mother Roger, &c. This may be printed, R.P.",Anonymous,Printed for J onah Deacon at the Angel in Guilt spur street,London,"Ballads, English --  17th century.",1685-1688?
B03083,E2858A,R175269,"Die Veneris, 18 Maii, 1660. Upon complaint this day made by the Commons, it is ordered by the Lords in Parliament assembled, that all these persons, viz. ...",England and Wales. Parliament. House of Lords.,Re printed by Christopher Higgins in Harts Close over against the Trone Church,Edinbvrgh,"Charles --  I, --  King of England, 1600-1649 --  Death and burial --  Early works to 1800. -- Regicides --  England --  Early works to 1800. -- Great Britain --  Politics and government --  1660-1688 --  Sources. -- Broadsides --  England --  17th century.",1660
B04353,M1877,None,"The merry wooing of Robin & Joan the West-Country lovers. To the tune of, The beginning of the world, or, Sellingers round, or, Great boobe.",Anonymous,Printed for J Conyers,London,"Ballads, English --  17th century.",1695
B05764,S2197A,R183650,"The seamans song of Danse[k?]ar the Dutchman, his robberies done at sea. To the same tune.",Anonymous,Printed for F Coles T Vere and William Gilbertson,London,"Danser, Simon de --  Poetry. -- Ward, John, fl. 1603-1615 --  Poetry. -- Ballads, English --  17th century. -- Pirates --  Poetry. -- Broadsides --  England --  17th century.",1658-1664?
B06004,S6111,None,"The subtil Miss of London: or, The ranting Hector well fitted by this cunning Miss, who by putting certain ingredients into his wine, laid him into a deep sleep, and striping his gallant attire, cloathed him in a red petticoat, and coyf [sic] on his head; then sent him in a great chest by water to Gravesend. To the tune of, The two English travellers. This may be printed, R.P.",Anonymous,Printed for J onah Deacon at the Angel in Guilt spur street without Newgate,London,Broadsides --  England --  London --  Early works to 1800. -- Man-woman relationships --  Early works to 1800. -- Tricksters --  Early works to 1800. -- Ballads --  England --  17th century.,1685-1688?
B01927,C1158,R227931,"The case of the right honourable William Harbourd, Esq; and Sir Francis Guybon, knight, chosen members for thr burrough of Thetford, to serve in this present Parliament.","Harbourd, William, Esq.; Guybon, Francis, 1673-1751.",s n,London,England and Wales. --  Parliament. --  House of Commons --  Contested elections --  Early works to 1800. -- Elections --  Corrupt practices --  England --  Thetford --  Early works to 1800. -- Thetford (England) --  Politics and government --  17th century --  Early works to 1800. -- Broadsides --  England --  17th century.,1690
B02398,C6348A,None,"Coridon and Parthenia, the languishing shepherd made happy. Or, Faithful love rewarded. Being a most pleasant and delectable new play song. Here mournful love is turn'd into delight, to this we a chast amorist invite; where charming beauty rules its powr's like death, to save or murder with the self-same breath: the noble swain, whose youthful love hath won so many mymphs [sic], by love was here undone: languishing faint, on the gold ground he lies, until the sun-shine of Parthenia's eyes dissolv'd the cloud that did benight his bliss, and turn'd his torments into Paradise. To the tune of, When busie fame.",Anonymous,Printed for P Brooksby at the Golden Ball in West smithfield,London,"Ballads, English --  17th century.",1675
B01827,B5437,None,"The bulls feather; being The good-fellows song, usually sung at their merry-meeting in Bulls Feather-Hall, who sent this song to their brethren, (of what degree or quality) in praise of the Bulls Feather. And to all merry cuckolds who think it no scorn, to wear the Bulls Feather, though made of a horn. To a very pleasant new tune: or: The Bulls Feather:.",Anonymous,Printed for F Coles T Vere J Wright and J Clarke,London,"Ballads, English --  17th century.",1674-1679?
B03249,E439,R3598,"An elegie on the Right Worshipful Sir Edmund-Bury Godfrey, Knight, one of His Majesties justices of the peace: who was found murtherd on Thursday the 17th of this instant October, 1678. in a ditch on the south-side of Primrose-Hill near Hampstead.",Anonymous,Printed for Ben Harris in Sweetings Rents near the Royal Exchange,London,"Godfrey, Edmund Berry, --  Sir, 1621-1678 --  Poetry --  Early works to 1800.",1678
B06655,W3082A,R186754,Sir John Wintours vindication from the aspersion of destroying the ship-timber of the forrest of Deane,Anonymous,s n,London,"Winter, John, --  Sir, 1600?-1673? -- Lumber trade --  Great Britain --  Deane --  Early works to 1800. -- Logging --  Great Britain --  Deane --  Early works to 1800.",1660
B02298,C5549,R33359,"A commentation on the late wonderful discovery of the new popish plot, being the Jesuites diabolick. Device to inveagle the son to betray the father.",Anonymous,Printed for T Addams,London,"Oates, Titus, 1649-1705 --  Poetry --  Early works to 1800. -- Popish Plot, 1678 --  Poetry --  Early works to 1800. -- Great Britain --  History --  Charles II, 1660-1685 --  Poetry --  Early works to 1800. -- Broadsides --  England --  London --  17th century.",1680
B04199,L3207,None,"Love in a bush: or, The two loyal lovers joy ccmpleated [sic]. She seem'd to slight her hearts delight, which caus'd him to complain: but when she see his loyalty, she made him glad again. Tune of, Oh so ungrateful a creature. This may be printed. R.P.",Anonymous,Printed for James Bissel at the Bible and Harp in West Smithfield,London,"Ballads, English --  17th century.",1687-1688?
B05719,S1968,R233216,"A proclamation, prohibiting the exportation of victual furth of this kingdom.",Scotland. Privy Council.; Scotland. Sovereign (1694-1702 : William II),Printed by the heirs and successors of Andrew Anderson Printer to the Kings most excellent Majesty,Edinburgh,Food law and legislation --  Scotland --  Early works to 1800. -- Export controls --  Scotland --  Early works to 1800. -- Broadsides --  Scotland --  17th century.,1698
B01743,B3897A,None,"Tobies experience explain'd: Good fellows all, whatever you be, I pray take this advice of me: strength will decay old age will come, therefore save something while your yong [sic] To the tune of, That dill doul","Bowne, Tobias.",Printed for P Brooksby in West smithfield,London,"Ballads, English --  17th century.",1670-1696?
B05668,S1888,R183523,"A proclamation, for preventing of false mustures [sic]",Scotland. Privy Council.; Scotland. Sovereign (1689-1694 : William and Mary),Printed by the heir of Andrew Anderson by order of secret council,Edinburgh,"Scotland --  Militia --  Recruiting, enlistment, etc. --  Early works to 1800. -- Broadsides --  Scotland --  17th century.",1689
B00792,24065,None,"Glad tydings from heauen: or Christs glorious inuitation to all sinners, wherein is described the misery of his manhood, and the bitternesse of his passion endured for man: with sundry reasons inferred, to moue worldlings to repentance. To the tune of the Dolefull shephard, or Sandy soyle.",Anonymous,Printed for C W,London,"Ballads, English --  17th century.",1630
B03238,E430,None,"An elegy on the much lamented Sir William Waller, who valiantly hang'd himself at Rotterdam.",Anonymous,Printed by N T at the entrance into the Old Spring Garden,London,"Waller, William, --  Sir, d. 1699 --  Poetry --  Early works to 1800. -- Popish Plot, 1678 --  Early works to 1800.",1683
B06175,T2010B,None,"The Tragedy of Phillis, complaining of the disloyall love of Amintas. To a new court tune.",Anonymous,Printed by E lizabeth P urslow for Francis Coles in Old Bayley,London,"Ballads, English --  17th century.",1641-1648?
B06624,W2430,R186685,"By the King, a proclamation. Whereas the Lords spiritual and temporal, and the knights, citizens, and burgesses in Parliament assembled, having taken into their serious consideration, the great mischiefs which this Our Kingdom lies under, by reason that the coin, which passes in payment, is generally clipped; ...","England and Wales. Sovereign (1694-1702 : William III); England and Wales. Sovereign (1694-1702 : William III); William III, King of England, 1650-1702.",Re printed by the heirs and successors of Andrew Anderson printer to his most excellent Majesty,Edinburgh,Coinage --  Law and legislation --  Great Britain --  Early works to 1800. -- Broadsides --  Scotland --  17th century.,1695
B06493,W1188,None,"The wealthy grasiers joyes compleated. Or, The shepherd's beautiful daughter obtained. His love was pure, and did endure, and will for evermore; her beauty bright is his delight, and her he doth adore. Tune of, Ladies of London, &c. This may be printed, R.P.",Anonymous,Printed for J onah Deacon at the Angel in Guiltspur street without Newgate,London,"Ballads, English --  17th century.",1685-1688?
B06075,S1009B,R183822,A proclamation Forasmuch as the lords of the Committy of our privy Council met in the west ... requiring and commanding all and sundry the heretors ... within the shyre of Air ... to appear personally before the said Lords ...,Scotland. Committee of the West.; Scotland. Sovereign (1649-1685 : Charles II),Printed by Robert Saunders Printer to the City and University by warrant of the Privy Council,Glasgow,"Horse owners --  Legal status, laws, etc. --  Scotland --  Early works to 1800. -- Confiscations --  Scotland --  Early works to 1800. -- Loyalty oaths --  Scotland --  Early works to 1800. -- Broadsides --  Scotland --  17th century.",1678
B05715,S1956,R183573,A proclamation offering a reward and indemnity to such as shall discover the burning of the house of Priest-field.,Scotland. Privy Council.; Scotland. Sovereign (1649-1685 : Charles II),Printed by the heir of Andrew Anderson Printer to his most sacred Majesty,Edinburgh,Arson --  Scotland --  Edinburgh --  Early works to 1800. -- Riots --  Scotland --  Edinburgh --  Early works to 1800. -- Broadsides --  Scotland --  17th century.,1681
B02867,D2958,None,"The dying tears of a penitent sinner. Which was written as he lay on his death-bed, according to his own direction. Wherein we may behold how stedfastly he believed in the precious death and passion of our Lord Jesus Christ, and how willing he was to leave this world. To the tune of, The faithful friend: or, The brothers gift.",Anonymous,Printed for F Coles T Vere J Wright J Clarke W Thackeray and T Passinger,London,"Ballads, English --  17th century.",1678-1681?
B05615,S1802,R183481,A proclamation for a solemn national thanksgiving.,Scotland. Privy Council.; Scotland. Sovereign (1694-1702 : William II),Printed by the heirs and successors of Andrew Anderson Printer to his most excellent Majesty,Edinburgh,Prayers --  Law and legislation --  Scotland --  Early works to 1800. -- Public worship --  Scotland --  Early works to 1800. -- Church and state --  Scotland --  Early works to 1800. -- Broadsides --  Scotland --  17th century.,1697
B01589,B2420B,R172886,"The psalms of David in meeter: by Mr. Zachary Boyd, preacher of God's word.","Boyd, Zacharie, 1585?-1653; Boyd, Zacharie, 1585?-1653",by George Anderson,Printed at Glasgow,"Bible. --  O.T. --  Psalms --  Paraphrases, English. -- Psalters --  Scotland --  17th century.",1646
B02023,C2669A,R173717,"By the King. A proclamation of his Majesties grace, favour, and pardon, to the inhabitants of his county of Glocester.","England and Wales. Sovereign (1625-1649 : Charles I); England and Wales. Sovereign (1625-1649 : Charles I); Charles I, King of England, 1625-1649.",Printed by Leonard Lichfield,Oxford,"Gloucestershire (England) --  History --  17th century --  Early works to 1800. -- Great Britain --  History --  Civil War, 1642-1649 --  Early works to 1800. -- Broadsides --  England --  17th century.",1642
B06659,W3115,None,"The Kings entertainment by the city of London. Sol radiis orbem illuminat, Rex Urbem.","Wiseman, Samuel.",Printed for Rowland Reynolds at the Sun and Bible in the Poultry,London,No Keywords,1671
B02294,C5500,None,"Come to it at last or The successful adventurer. A pleasant and delightful new song. In vain resistances when love designes he by compulsion or complyance joyns, laughs at what e're opposes his decree and what sayes must, that must surely be. A pleasant new tune, or, Tell me Jenny.",Anonymous,Printed for J VVright J Clark VV Thackery and T Passenger,London,"Ballads, English --  17th century.",1681-1684?
B02123,C3462,R171281,Proclamation for the Convention of Estates,"Scotland. Sovereign (1649-1685 : Charles II); Scotland. Sovereign (1649-1685 : Charles II); Charles II, King of England, 1630-1685.; Scotland. Convention of Estates.",Printed by Evan Tyler printer to the Kings most Excellent Majesty,Edinbvrgh,"Scotland. --  Convention of Estates. -- Anglo-Dutch War, 1664-1667 --  Early works to 1800. -- Scotland --  Politics and government --  1660-1688 --  Sources. -- Broadsides --  Scotland --  17th century.",1666
B01848,B5773,R170915,"The declaration of almighty God, in some few texts of scripture, recommended to the reverend conforming divines: / by G.B. B. of S----b---y ... being the publick fast appointed to implore God's assistance for the reduction of Ireland, and the overthrow of the late King James, and his rebellious forces.","Burnet, Gilbert, 1643-1715.",s n,London,"Sermons, English --  17th century. -- Fast-day sermons --  Early works to 1800. -- Broadsides --  England --  17th century.",1690
B03226,E413,R36112,"An elegy on the death of William late Viscount Stafford, who was beheaded on Tower-Hill, on Wednesday, December 29th. 1680. / By a person of quality.",Person of quality.,Printed for William Miller at the Guilded Acorn in St Paul s Church Yard where you may be furnished with most sorts of bound or stitched books as Acts of Parliament proclamations speeches declarations letters orders commissions articles of war or peace as also books of divinity church government sermons on most occasions and most sorts of histories poetry plays and such like c,London,"Stafford, William Howard, --  Viscount, 1614-1680 --  Poetry --  Early works to 1800. -- Elegiac poetry, English --  17th century.",1681
B05963,S5333,None,"The statesman's last will and testament; or, His worthy legacies left to his beloved cronies, for whom he had a particular kindness. Tune of, O rare Popery.",Anonymous,s n,London,"Ballads, English --  17th century.",1689
B02140,C3769,None,"The chearful husband: or, The despairng [sic] wife. In a dialogue between a loving couple, about the cares and crosses of these troublesome times. To the tune of, The jealous lover.",Anonymous,Printed for J Blare at the Looking glass on London bridge,London,"Ballads, English --  17th century.",1689-1690?
B01948,C143,None,"Vindiciae pharmacapolae, or An answer to the doctors complaints against apothecaries. Ou, poiei eas mia chelidōn.",T. C.,s n,London,Pharmacists --  Poetry --  Early works to 1800.,1675
B04241,L3295,None,"The loving shepherd: or, Phaon's humble petition to beautiful Phillis, who readily answered his request. To an excellent new tune much in request. Licensed according to order.",Anonymous,Printed for P Brooksby J Deacon J Blare J Back,London,"Ballads, English --  17th century.",1688-1692?
B05776,S2311,None,"The second part of the new Scotch-jigg: or, Jenny's reply, to Johnny's cravat. The case [i]s alter'd now; Jenny wooes Johnny to tye he kirtle, and shee'l be his honey; which Johnny took so kindly sitting by her, that for his heart, he could not well deny her, at length they did agree, so plain and pat, that he her kirtle ty'd; she his cravat. Tune of, Jenny come tye my, &c.",Anonymous,Printed for W illiam Thackeray T homas Passenger and W illiam Whoditwo sic,London,"Ballads, English --  17th century.",1670-1677?
B05127,R908,None,"The religious mans exhortation to all persons of what degree soever, especially youth; that they may fear God and honour their parents. Reform thy life then free from strife, thou wouldst be perfect free, when e're you dye, assuredly, to true felicity. To the tune of, The young-man's legacy: or, Sinners redemption.",Anonymous,Printed for P Brooksby at the Golden Ball in Pye Corner,London,"Ballads, English --  17th century.",1685-1688?
B04341,M1737,None,"An elegie in memorie, and at the interring of the body of the most famous and truely noble knight, Sir Henrie Mervyn. Paterne of all true valour; worth, and arts, who departed this life the 30. of May, and lyes interred at Westminster, anno Do: 1646.","Mercer, William, 1605?-1676?; Mercer, William, 1605?-1676?",Printed by Jane Coe,London,"Mervyn, Henry, --  Sir, d. 1646 --  Poetry --  Early works to 1800. -- Elegiac poetry, English --  17th century.",1646
B05676,S1898,R183529,A proclamation for re-establishing the staple-port at Camphire.,Scotland. Privy Council.,Printed by the heirs and successors of Andrew Anderson Printer to the King s most excellent Majesty,Edinburgh,Harbors --  Law and legislation --  Scotland --  Early works to 1800. -- Scotland --  Commerce --  Netherlands --  Early works to 1800. -- Netherlands --  Commerce --  Scotland --  Early works to 1800. -- Zeeland (Netherlands : Province) --  History --  17th century --  Early works to 1800. -- Broadsides --  Scotland --  17th century.,1699
