id,stc,estc,title,author,publisher,pubplace,keywords,date
B04295,L498B,R179659,"The last offers of the noblemen and gentlemen now in armes for the Covenant, to the Earls of Craford Glencairn and Lanerk, George Munro and others joyned with them in the late unlawfull engagement against the kingdome of England.","Henderson, Thomas, fl. 1649.",Printed by Evan Tyler Printer to the Kings most excellent Majestie,Edinburgh,"Glencairn, William Cunningham, --  Earl of, 1610?-1664. -- Crawford-Lindsay, John Lindsay, --  Earl of, 1596-1678. -- Hamilton, James Hamilton, --  Duke of, 1606-1649. -- Scotland --  History --  1625-1649 --  Early works to 1800. -- Scotland --  Politics and government --  1625-1649 --  Early works to 1800. -- Broadsides --  Scotland --  17th century.",1648
B04773,P2880B,R181945,"Poor Robin's dream, commonly call'd, Poor charity. I know no reason but this harmless riddle, may as well be printed as sung to a fiddle. To a compleat tune, known by musicians and many others, or, Game at cards.",Anonymous,Printed for J Clark,London,"Ballads, English --  17th century. -- Broadsides --  England --  17th century.",1670
B06208,T2380B,R185472,"A true account of the late actions betvveen the Confederate Army commanded by Prince Levvis of Baden, and that of the French, under Marishal De Lorge: wherein three thousand five hundred of the French were kill'd and wounded, with 1500 prisoners: many tinn boats, and two standards, &c. were taken. In a letter from Hailbron.",Anonymous,Re printed by the Heir of Andrew Anderson Printer to Their most Excellent Majesties,Edinburgh,"Grand Alliance, War of the, 1689-1697 --  Campaigns --  Germany --  Heilbronn --  Early works to 1800. -- Broadsides --  Scotland --  17th century.",1693
B04966,Q157C,R182311,"The queens lamentation, or, The most sad and mournfull complaint of her sacred majesty, the Queen of England, upon the death of her most dear and well esteemed son, the most elustrious prince, Henry, Duke of Glocester, 3d. brother to our gracious king, Charles the 2d. Deceased the 13. of September, 1660. Carried over from France, by Sir James O Neal, knight and baronet; comitted to the press by his own inportuning desire. To the tune of, Franklin.",Anonymous,Printed for Charles Tyus,London,"Henry, --  Duke of Gloucester, 1640-1660 --  Poetry. -- Henrietta Maria, --  Queen, consort of Charles I, King of England, 1609-1669 --  Poetry. -- Ballads, English --  17th century. -- Broadsides --  England --  17th century.",1660
B02572,C8,None,"A mite from three mourners: in memorial of Thomas Glass, a pattern of faith and patience in the Churches, naturally caring for their state, who died in the lord, the 30th day of the Seventh month, 1666. being the same day twelve-month that the beloved John Wiggan (his fellow-labourer, and witness to the cause of Christ) was taken from the evil to come.",A. C.; W. A.,s n,London,"Glass, Thomas, d. 1666 --  Poetry --  Early works to 1800. -- Elegiac poetry, English --  17th century.",1666
B05468,S1602,R183339,"A proclamation against regrating of victual, and fore-stallers, and allowing the importation of victual free of publick burden.",Scotland. Privy Council.; Scotland. Sovereign (1694-1702 : William II),Printed by the heirs and successors of Andrew Anderson Printer to the Kings most excellent Majesty,Edinburgh,Food law and legislation --  Scotland --  Early works to 1800. -- Broadsides --  Scotland --  17th century.,1698
B01543,B1655AA,R172682,"A description of the royal fireworks, prepared for celebrating the universal joy, for the inestimable blessing afforded by God to the King, Queen, and people of these realms, in the happy birth of the most illustrious Prince of Wales, presented on the Thames over-againts White-hall, on Tuesday night the 17th of July, 1688, before both their Majesties, the Queen Dowager, the Prince and Princess of Denmark, and the whole court.","Beckman, Martin, d. 1702.",s n,London,"James, --  Prince of Wales, 1688-1766 --  Birth --  Early works to 1800. -- Great Britain --  History --  James II, 1685-1688 --  Sources. -- Broadsides --  England --  17th century.",1688
B05568,S1750,R183441,"A proclamation, discharging merchants and other traffickers to sell or exchange any prohibite [sic] commodities, with themselves, or amongst others.",Scotland. Privy Council.; Scotland. Sovereign (1649-1685 : Charles II),Printed by the heir of Andrew Anderson Printer to his most sacred Majesty,Edinburgh,Trade regulation --  Scotland --  Early works to 1800. -- Import quotas --  Scotland --  Early works to 1800. -- Broadsides --  Scotland --  17th century.,1683
B03138,E349,R36157,"An elegy in commemoration of Sr. Edmund Saunders, late lord chief justice of H[i]s Majesties Court of Kings-Bench; vvho departed this life the 19th of this instant June, anno Domini, 1683.",Anonymous,Printed for Langly Curtes sic,London,"Saunders, Edmund, --  Sir, d. 1683 --  Poetry --  Early works to 1800. -- Elegiac poetry, English --  17th century.",1683
B06524,W1405,None,"The west-country miser: or, An unconscionable farmer's miserable end: who having hoarded up his corn in hopes it would rise to a higher price, was disappointed so that he fell into despair, and died at last by the fright of an apparition. Tune of, Love's sweet passion: or, Fond boy, &c.",Anonymous,Printed for J Wolrah in Holbourn,London,"Ballads, English --  17th century.",1688-1689?
B06375,U109AA,R185891,Upon the death of the truly valiant and magnanimous Sr. Christoph. Minns wounded at sea.,Anonymous,Printed for Joseph Godwin,Oxford,"Myngs, Christopher, --  Sir, 1625-1666 --  Death and burial --  Poetry. -- Anglo-Dutch War, 1664-1667 --  Poetry. -- Elegiac poetry, English --  17th century. -- Broadsides --  England --  17th century.",1666
B03038,E2197,R172030,"A proclamation, of both Houses of Parliament, for proclaiming of his Majesty King of England, Scotland, France, and Ireland, defender of the faith, &c.",England and Wales. Parliament.,Re printed by Christopher Higgins in Harts Close over against the Trone Church,Edinburgh,"Charles --  II, --  King of England, 1630-1685. -- Great Britain --  History --  Restoration, 1660-1688 --  Sources. -- Broadsides --  Scotland --  17th century.",1660
B06316,T3488,R235578,"The two Lymas lovers, Thomas and Betty. Set forth in a dialogue between them at his departure ... Tune of, She so ungrateful a creature.",Anonymous,Printed for J Deacon at the Angel in Gilt spur street,London,"Ballads, English --  17th century. -- Broadsides --  England --  17th century.",1682-1700?
B02411,C6529,None,"The countrey farmer: or, The buxome virgin. To a new tune, called, New-Market, or King James's jigg;",Anonymous,Printed for P Brooksby at the Golden Ball in Pye Corner,London,"Broadsides --  England --  London --  Early works to 1800. -- Love poetry, English --  England --  Early works to 1800. -- Ballads --  England --  17th century.",1675-1680?
B04141,L2864GA,R173836,"Chiverton Mayor.  Tuesday the eighth day of December 1657.  An order of the Lord Mayor and Court of Aldermen, against concealing and colouring the goods of aliens and foreyners.","City of London (England). Lord Mayor.; City of London (England). Lord Mayor.; Chiverton, Richard.; City of London (England). Court of Aldermen.",Printed by James Flesher printer to the honourable City of London,London,Customs administration --  Law and legislation --  London (England) --  17th century. -- London (England) --  Commerce --  17th century --  Sources. -- Broadsides --  England --  17th century.,1657
B03962,K480,None,"The kind mistress: who being jealous that the man she lov'd, constant unto another woman prov'd, she could not brook another should possess, him whom she lov'd more then she could express: she bids him give her wealth and honour, all but his ownself, him she her own must call. To a pleassant new tune, call'd, The German princess's farewel, &c.",Anonymous,s n,London,"Ballads, English --  17th century.",1673
B04041,L2205,None,"Lillies invitation. [To th]ose that have had no coughs, nor colds, this winter, to dine with him on Christmas day.",Anonymous,s n,London,"Lilly, William, 1602-1681 --  Poetry --  Early works to 1800.",1668
B05576,S1760,R233616,"A proclamation, discharging the exportation of victual.",Scotland. Privy Council.; Scotland. Sovereign (1689-1694 : William and Mary),Printed by the heir of Andrew Anderson Printer to the King and Queens excellent Majesties,Edinburgh,Food law and legislation --  Scotland --  Early works to 1800. -- Export controls --  Scotland --  Early works to 1800. -- Broadsides --  Scotland --  17th century.,1690
B03622,H12,None,"Fancies favourite: or, The mirror of the times. Being a young ladies commendation of a young gallant, which hath a long time shewed her much love; which by his civil carriage, and long patience in waiting on her, at last conquered her, who was once resolved to lead a single life, and therefore he termed her the Phoenix of the times. To the tune of, Francis Phoenix.",C. H.,Printed for F rancis Coles T homas Veres sic J ohn Wright and J ohn Clarke,London,"Ballads, English --  17th century.",1674-1679?
B05694,S1926,R183551,"A proclamation, for the better inbringing of the hearth-money",Scotland. Privy Council.; Scotland.  Sovereign (1689-1694 : William and Mary),Printed by the heir of Andrew Anderson,Edinburgh,Hearth-money --  Law and legislation --  Scotland --  Early works to 1800. -- Broadsides --  Scotland --  17th century.,1691
B04745,P2671,None,A poem dedicated to the lasting honour of the pious and reverend divine Mr. Richard Baxter.,Anonymous,s n,London,"Baxter, Richard, 1615-1691 --  Poetry --  Early works to 1800.",1680
B06512,W1341,None,"The Welsh-mens glory, or, The famous victories of the antient Britans obtain'd upon St. David's day.",Anonymous,Printed by Thomas Dawks his Majesties British printer at the west end of T,London,Wales --  History --  Poetry --  Early works to 1800.,1684
B06243,T2740,None,"The true lovers admonition. Of all the colours in the world, the black hair is the best, though fair & brown may be well curl'd yet black exceeds the rest: that is the colour I do prize, and love beyond all measure, she that hath black hair and black eyes, esteem her as a treasure. The tune is, So sweet is the lass that loves me,.",Anonymous,Printed for P Brooksby at the Golden Ball in Pye corner,London,"Ballads, English --  17th century.",1670-1696?
B02439,C6589AA,R174352,"The court of England. Or, The preparation for the happy coronation of King William and Queen Mary",Anonymous,By the heir of A Anderson,Edinburgh,"William --  III, --  King of England, 1650-1702 --  Coronation --  Poetry. -- Mary --  II, --  Queen of England, 1662-1694 --  Coronation --  Poetry. -- Broadsides --  Scotland --  17th century.",1689
B02368,C5976,None,"The contriving lover: or, The fortunate mistake. With the old vvomans journey to heaven up the chimney in a hand-basket. Together with her dreadful downfall from the chimney-top to the chimney-corner. To the tune of, I often for my Jenny strove, &c. Licensed according to order.",Anonymous,Printed for R ichard Kell at the Blew Anchor in Pye Corner,London,"Ballads, English --  17th century.",1690
B04169,L2988,None,Long lookt for come at last; or t[h]e peace proclaimed.,Anonymous,s n,London,No Keywords,1667
B04626,O305,None,On the death of his grace the Duke of Albemarle.,Anonymous,s n,London,"Albemarle, George Monck, --  Duke of, 1608-1670 --  Poetry --  Early works to 1800. -- Death --  Poetry --  Early works to 1800.",1670
B05311,S1408,R182987,"Act discharging any person to go aboard of, or correspond with French privateers. Edinburgh, August 3, 1697.",Scotland. Privy Council.,Printed by the heirs and successors of Andrew Anderson Printer to the King s most excellent Majesty,Edinburgh,"Grand Alliance, War of the, 1689-1697 --  Collaborationists --  Scotland --  Early works to 1800. -- Scotland --  Foreign relations --  France --  Early works to 1800. -- France --  Foreign relations --  Scotland --  Early works to 1800. -- Broadsides --  Scotland --  17th century.",1697
B04591,N793,None,"The nevv way of marriage. Or, A pleasant contract between John and Kate. Marriage that simple contract still doth bind, and mittigate the freedom of the mind: Kate for prevention of that endless strife, will be a mistris rather then a wife. To a pleasant new tune. With allowance.",Anonymous,Printed for P Prooksby sic at the G olden Ball in West smith field,London,Broadsides --  England --  London --  Early works to 1800. -- Man-woman relationships --  Early works to 1800. -- Ballads --  England --  17th century.,1670-1696?
B04726,P2556A,R181871,"A pleasant new ballad, on Sir John Barleycorn the tune is: Shall I ly beyond thee.",Anonymous,s n,London,"Ballads, English --  17th century. -- Broadsides --  England --  17th century.",1670-1700?
B02376,C6053,None,"The asse beaten for bawling; or, A replie from the city to the crie of the country.","Cooper, Edmund.",Printed by J ohn Brudenell dwelling in Maiden head ally near New Gate,London,"Political satire, English --  Early works to 1800. -- Great Britain --  History --  Commonwealth and Protectorate, 1649-1660 --  Early works to 1800.",1661
B03010,E164N,R176004,"The table of the prices to be payed to the bell-men and grave-makers; appointed by the Council of Edinburgh, February 12. 1658. As follows:.",Edinburgh (Scotland). City Council.; Edinburgh (Scotland). City Council.,s n,Edinburgh,"Gravediggers --  Salaries, etc. --  Scotland --  Edinburgh --  Early works to 1800. -- Sextons --  Salaries, etc. --  Scotland --  Edinburgh --  Early works to 1800. -- Broadsides --  Scotland --  17th century.",1658
B02527,C7453AD,T34468,"The cuckold in Purgatory: or, The fall of the second man, Adam",Anonymous,s n,S l,"Ballads, English --  17th century. -- Broadsides --  England --  17th century.",1641-1700?
B03741,H475A,R177814,"Articles established by Alexander Hamilton, formerly merchant in Rouen in France, now in Edinburgh, and his partners in the erecting in the said city, a profitable adventure for the fortunat, of fifty thousand tickets, of half a crown each. December 9, 1693.","Hamilton, Alexander, merchant.",s n,Edinburgh,Raffles --  Scotland --  Early works to 1800. -- Lotteries --  Scotland --  Early works to 1800.,1693
B04942,P706A,R187029,"To the memory of the right Honourable Margaret Countess of Weems. Who departed this life at Weems, February 20 1688. A funeral elegie. / N. Paterson.","Paterson, Ninian, d. 1688.",s n,Edinburgh,"Wemyss, Margaret Leslie, --  Countess of, d. 1688 --  Death and burial --  Poetry. -- Elegiac poetry, Scottish --  Early works to 1800. -- Broadsides --  Scotland --  17th century",1688
B02456,C6775,None,"The crafty lass of the west: or, A pleasant ditty of a modest maid, who mortgag'd her maiden-head for a high-crown'd hat. Tune of Liggan-water. Licensed according to order.",Anonymous,Printed for P hilip Brooksby J onah Deacon J osiah Blare J ohn Back,London,"Ballads, English --  17th century.",1688-1692?
B04757,P270A,R181420,"Panegyrick upon the death of Lieut. Thomas Hadow. Who deceased 4th of April 1700, in the 27th year of his age, having been ten years an officer in King William's service.",Anonymous,s n,Scotland,"Hadow, Thomas, --  Lieutenant --  Death and burial --  Poetry --  Early works to 1800. -- Elegiac poetry, English --  Scotland --  Early works to 1800. -- Broadsides --  Scotland --  17th century.",1700
B04006,L166,R228329,"The Lady Isabella's tragedy; or, The step-mothers cruelty. Being a relation of a most lamentable and cruel murder ... occasioned by the means of a step-mother and the master-cook ... To the tune of, The ladies fall.",Anonymous,Printed for P Brooksby,London,"Ballads, English --  17th century. -- Broadsides --  England --  17th century.",1672-1696?
B01404,A3423,None,"An answer to the maiden's tragedy: or, The lamentation of a young man, near Wolverhampton, for the death of a young maiden; which of late has been a great grief and trouble to him, for his unkindness to her. To the tune of, Russel's farewel.",Anonymous,Printed for P Brooksby J Deacon J Blare and J Back,London,"Ballads, English --  17th century.",1690
B00033,10626.5,R224566,"A godly exhortation, necessary for this present time.",Anonymous,by Simon Stafford dwelling in Hosier lane neere Smithfield,Imprinted at London,Prayers --  Early works to 1800. -- Christian life --  Early works to 1800.,1603
B05698,S1931,R183555,Proclamation for the more easie and effectual in-bringing of the pole-money.,Scotland. Privy Council.; Scotland. Sovereign (1694-1702 : William II),Printed by the heirs and successors of Andrew Anderson Printer to the King s most excellent Majesty,Edinburgh,Poll tax --  Law and legislation --  Scotland --  Early works to 1800. -- Tax collection --  Scotland --  Early works to 1800. -- Broadsides --  Scotland --  17th century.,1698
B06563,W170E,R186135,"A song in praise of the leather bottel ... To the tune of, The bottle-maker's delight, &c.","Wade, John, fl. 1660-1680.",s n,London,"Ballads, English --  17th century. -- Broadsides --  England --  17th century.",1700
B05552,S1730,R183427,"A proclamation, containing his Majesties gracious pardon and indemnity to the commoners within the shires of Argile and Tarbat",Scotland. Privy Council.; Scotland. Sovereign (1685-1688 : James VII),Printed by the heir of Andrew Anderson Printer to his most sacred Majesty,Edinburgh,Amnesty --  Scotland --  Early works to 1800. -- Argyllshire --  Politics and government --  Early works to 1800. -- Tarbert (Scotland) --  Politics and government --  Early works to 1800. -- Broadsides --  Scotland --  17th century.,1686
B01479,A643,R34207,Advice to a wavering friend.,Anonymous,s n,London,No Keywords,1680
B04583,N765B,None,"A new song of lulla by, or, Father Peter's policy discovered. A pritty babe, and hopeful son, of late we much did boast, but now, alas! we are undone, was ever Rome so crost. To the tune of, Green Sleeves. Or, My mistriss is to bulling gone.",Anonymous,s n,London,"Ballads, English --  17th century.",1688
B02997,E160CF,R174850,"Act anent suppressing conventicles, &c.",Edinburgh (Scotland). Town Council.; Edinburgh (Scotland). Town Council.,Printed by the heir of Andrew Anderson printer to his most sacred Majesty,Edinburgh,"Dissenters, Religious --  Scotland --  Edinburgh --  Legal status, laws, etc. --  Early works to 1800. -- Broadsides --  Scotland --  17th century.",1684
B04634,O335,R35080,"One broad-side more for the Dutch: or, The Belgick lion couchant.",Anonymous,Printed by R D,London,"Great Britain --  History --  Charles II, 1660-1685 --  Poetry --  Early works to 1800.",1665
B05303,S1402,R182978,"Act appointing collectors of shires to receive clipped merk-pieces from the parish-collectors of the pole-money, and ordaining diligence against parish-collectors. Edinburgh, January 28, 1696.",Scotland. Privy Council.,Printed by the heirs and successors of Andrew Anderson Printer to the Kings most excellent Majesty,Edinburgh,Poll tax --  Law and legislation --  Scotland --  Early works to 1800. -- Tax collection --  Scotland --  Early works to 1800. -- Broadsides --  Scotland --  17th century.,1696
B04165,L2949,None,"Londons plague from Holland, or Inquiries after the natural causes of her present calamity.",Anonymous,s n,London,London (England) --  History --  17th century --  Poetry --  Early works to 1800. -- Netherlands --  Early works to 1800.,1684
B04821,P3376A,None,"The merry mans resolution or, His last farewell to his former acquaintance, declaring how hee rambled up and down, through all the suburbs of fair London town, where pretty wenches hee did plenty find, but some of them agreed not with his mind, till at the last by chance hee found out one, which pleas'd him best, so left the rest alone, to her hee then cling'd close as I heard tell, made her his mate and bid the rest farewell. To a gallant new tune, called the Highlanders new rant.","L. P. (Laurence Price), fl. 1625-1680?; L. P. (Laurence Price), fl. 1625-1680?",printed for F Grove on Snow Hill,London,"Ballads, English --  17th century.",1650
B02364,C5951A,R176381,Containing ane encomaistick [sic] character of the famous city of Dumbrittai[n],Anonymous,J van Solingen and J Colmer,Edinburgh,"Ballads, Scots --  17th century. -- Dumbarton (Scotland) --  History --  Poetry --  Early works to 1800. -- Scotland --  Description and travel --  Poetry --  Early works to 1800. -- Broadsides --  Scotland --  17th century.",1685
B03653,H1959A,R178028,"The wonderfull and true relation of the bewitching a young girle in Ireland, what way she was tormented, and a receipt of the ointment that she was cured with.","Higgs, Daniel.",s n,S l,Demoniac possession --  Case studies --  Ireland --  17th century. -- Witches --  Ireland --  17th century. -- Exorcism --  Early works to 1800. -- Devil --  Early works to 1800. -- Folk medicine --  Ireland --  17th century. -- Ireland --  Social life and customs --  17th century.,1699
B02435,C6579,None,"The couragious gallant; or, Cupid degraded. True lovers grief may find relief, good wine will cure the cause; then fill the glass, and let it pass, a figg for Cupids laws. To the tune of, Four-pence-half-penny-farthing. This may be printed, R.P.",Anonymous,Printed for I onah Deacon at the Angel in Guilt spur street without Newgate,London,"Ballads, English --  17th century.",1685-1688?
B06313,T3452,R200202,"Two great victories. I. One obtained by Collonel Fleetvvood at Shaftsbury on Sunday, August the 3. 1545 [sic]. 51 of the Kings Commissioners taken prisoners as they sate in Councell, with a perfect list of all their names. II. Another victory obtained by Lieutenant Generall Crumwell, against the Club-men at Hambleton-Hill. 2500 routed. 300 taken prisoners. 2000 armes taken. 12 slaine upon the place. Many wounded. Also all their colours, and drums taken, and all the rest of their baggage. Commanded to be printed, and is published according to order.",Anonymous,Printed by T Forcet,London,"Fleetwood, Charles, d. 1692. -- Cromwell, Oliver, 1599-1658. -- Shaftesbury (England) --  History. -- Hambleton Hills (England) --  History. -- Great Britain --  History --  Civil War, 1642-1649 --  Early works to 1800.",1645
B00112,12545,None,"The merry carelesse lover: or, A pleasant new ditty, called, I love a lasse since yesterday, and yet I cannot get her. To the tune of, The mother beguilde the daughter.","Guy, Robert, writer of ballads.",For F Coules,Printed at London,"Ballads, English --  17th century.",1640
B04768,P2762,None,"The politick countreyman. Plainly setting forth the many misfortunes of those men who have mist of their ... in choosing a wife, also discovering the vast difference between the London mistrisses and the country dames. Tune of, Hey boys up go we, or, Jenny Gin.",Anonymous,Printed for J ohn Wright J ohn Clark W illiam Thackery and T homas Passenger,London,"Ballads, English --  17th century.",1681-1684?
B01692,B3472,None,"On the thunder, happening after the solemnity of the coronation of Charles the II. on St. George's Day. 1661.","Bold, Henry, 1627-1683.",printed for R Crofts,London,"Charles --  II, --  King of England, 1630-1685 --  Coronation --  Poetry --  Early works to 1800.",1661
B01792,B4830,None,"A broad-side against coffee; or, the marriage of the Turk",Anonymous,Printed for J L,London,Coffee habit --  Controversial literature --  Early works to 1800.,1672
B06688,W3326,None,"A vvomans vvork is never done Here is a song for maids to sing, both in the winter and the spring; it is such a pretty conceited thing, which will much pleasure to them bring. Maids may sit still, go, or run, but a womans work is never done. To a delicate northern tune, A womans work is never done, or, The beds making.",Anonymous,Printed for John Andrews at the White Lion in Pye Corner,London,"Ballads, English --  17th century.",1660
B03123,E3173,R11342,"An epitaph upon His late Majesty, King Charles the II.",Anonymous,Printed for P hilip Brooksby at the Golden Ball in Pye Corner,London,"Charles --  II, --  King of England, 1630-1685 --  Early works to 1800.",1685
B02345,C5841,R33396,"A congratulatory poem upon the arrival of His Electoral Highness the Prince Palatine of the Rhine, nephew to his Highness Prince Rupert.",Anonymous,Printed for Langley Curtiss,London,"Karl Ludwig, --  Elector Palatine, 1617-1680 --  Poetry --  Early works to 1800.",1680
B06788,Y133,None,"The young-womans answer to her former sweet-heart on board one of His Majesty's ships, who complains of her vnkindness. Tune of, I lov'd you dearly, &c.",Anonymous,Printed for Charles Barnet,London,"Ballads, English --  17th century.",1694
B04144,L2889A,R180109,"London and England triumphant: At the proclaiming of King Charls the Second, by both the Houses of Parliament, the Judges of the Land: with the Lord Mayor, the Court of Aldermen, and Council of the City, as it was performed with great solemnity, and loud acclamations of joy by the people in general. May the 8th. 1660. To the tune of, I am a jovial batchelor.",Anonymous,Printed for F Grove,London,"Charles --  II, --  King of England, 1630-1685 --  Poetry. -- Lilly, William, 1602-1681 --  Poetry. -- Booker, John, 1603-1667 --  Poetry. -- Albemarle, George Monck, --  Duke of, 1608-1670 --  Poetry. -- Ballads, English --  17th century. -- Broadsides --  England --  17th century.",1660
